Cite Key,Title,Authors,Year,Publication Date,Journal,Volume,Pages,Abstract,Citation Count,Citations/Year,DOI,URL,Relevance Score
Pap25b,AppVLM: A Lightweight Vision Language Model for Online App Control,Georgios Papoudakis et al.,2025,2025-02-10,ArXiv,abs/2502.06395,,"The utilisation of foundation models as smartphone assistants, termed app agents, is a critical research challenge. These agents aim to execute human instructions on smartphones by interpreting textual instructions and performing actions via the device's interface. While promising, current approaches face significant limitations. Methods that use large proprietary models, such as GPT-4o, are computationally expensive, while those that use smaller fine-tuned models often lack adaptability to out-of-distribution tasks. In this work, we introduce AppVLM, a lightweight Vision-Language Model (VLM). First, we fine-tune it offline on the AndroidControl dataset. Then, we refine its policy by collecting data from the AndroidWorld environment and performing further training iterations. Our results indicate that AppVLM achieves the highest action prediction accuracy in offline evaluation on the AndroidControl dataset, compared to all evaluated baselines, and matches GPT-4o in online task completion success rate in the AndroidWorld environment, while being up to ten times faster. This makes AppVLM a practical and efficient solution for real-world deployment.",15,12,10.48550/arXiv.2502.06395,https://doi.org/10.48550/arXiv.2502.06395,1.0000
Yan25x,Step-GUI Technical Report,Haolong Yan et al.,2025,2025-12-17,ArXiv,abs/2512.15431,,"Recent advances in multimodal large language models unlock unprecedented opportunities for GUI automation. However, a fundamental challenge remains: how to efficiently acquire high-quality training data while maintaining annotation reliability? We introduce a self-evolving training pipeline powered by the Calibrated Step Reward System, which converts model-generated trajectories into reliable training signals through trajectory-level calibration, achieving>90% annotation accuracy with 10-100x lower cost. Leveraging this pipeline, we introduce Step-GUI, a family of models (4B/8B) that achieves state-of-the-art GUI performance (8B: 80.2% AndroidWorld, 48.5% OSWorld, 62.6% ScreenShot-Pro) while maintaining robust general capabilities. As GUI agent capabilities improve, practical deployment demands standardized interfaces across heterogeneous devices while protecting user privacy. To this end, we propose GUI-MCP, the first Model Context Protocol for GUI automation with hierarchical architecture that combines low-level atomic operations and high-level task delegation to local specialist models, enabling high-privacy execution where sensitive data stays on-device. Finally, to assess whether agents can handle authentic everyday usage, we introduce AndroidDaily, a benchmark grounded in real-world mobile usage patterns with 3146 static actions and 235 end-to-end tasks across high-frequency daily scenarios (8B: static 89.91%, end-to-end 52.50%). Our work advances the development of practical GUI agents and demonstrates strong potential for real-world deployment in everyday digital interactions.",15,30,10.48550/arXiv.2512.15431,https://doi.org/10.48550/arXiv.2512.15431,1.0000
Cao26b,GUI-GENESIS: Automated Synthesis of Efficient Environments with Verifiable Rewards for GUI Agent Post-Training,Yuan Cao et al.,2026,2026-02-15,ArXiv,abs/2602.14093,,"Post-training GUI agents in interactive environments is critical for developing generalization and long-horizon planning capabilities. However, training on real-world applications is hindered by high latency, poor reproducibility, and unverifiable rewards relying on noisy visual proxies. To address the limitations, we present GUI-GENESIS, the first framework to automatically synthesize efficient GUI training environments with verifiable rewards. GUI-GENESIS reconstructs real-world applications into lightweight web environments using multimodal code models and equips them with code-native rewards, executable assertions that provide deterministic reward signals and eliminate visual estimation noise. Extensive experiments show that GUI-GENESIS reduces environment latency by 10 times and costs by over $28,000 per epoch compared to training on real applications. Notably, agents trained with GUI-GENESIS outperform the base model by 14.54% and even real-world RL baselines by 3.27% on held-out real-world tasks. Finally, we observe that models can synthesize environments they cannot yet solve, highlighting a pathway for self-improving agents.",1,2.0,10.48550/arXiv.2602.14093,https://doi.org/10.48550/arXiv.2602.14093,1.0000
Ram25,Grounding Multimodal LLMs to Embodied Agents that Ask for Help with Reinforcement Learning,Ram Ramrakhya et al.,2025,2025-04-01,ArXiv,abs/2504.00907,,"Embodied agents operating in household environments must interpret ambiguous and under-specified human instructions. A capable household robot should recognize ambiguity and ask relevant clarification questions to infer the user intent accurately, leading to more effective task execution. To study this problem, we introduce the Ask-to-Act task, where an embodied agent is tasked with a single or multi-object rearrangement task using an under-specified instruction in a home environment. The agent must strategically ask minimal, yet relevant, clarification questions to resolve ambiguity while navigating under partial observability. To address this challenge, we propose a novel approach that fine-tunes multi-modal large language models (MLLMs) as vision-language-action (VLA) policies using online reinforcement learning (RL) with LLM-generated rewards. Our method eliminates the need for large-scale human demonstrations or manually engineered rewards for training such agents. We benchmark against strong zero-shot baselines including GPT-4o as well as supervised fine-tuned MLLMs on our task. Our results show that our RL-finetuned MLLM outperforms all baselines by a significant margin (10.4-16.5%), generalizing well to novel scenes and tasks. To the best of our knowledge, this is the first demonstration of adapting MLLMs as VLA agents that can act and ask for help using LLM-generated rewards with online RL.",17,15,10.48550/arXiv.2504.00907,https://doi.org/10.48550/arXiv.2504.00907,1.0000
Lu25j,UI-S1: Advancing GUI Automation via Semi-online Reinforcement Learning,Zhengxi Lu et al.,2025,2025-09-15,ArXiv,abs/2509.11543,,"Graphical User Interface (GUI) agents have demonstrated remarkable progress in automating complex user interface interactions through reinforcement learning. However, current approaches face a fundamental dilemma: offline RL enables stable training on pre-collected trajectories, but struggles with multi-step task execution for lack of trajectory-level reward signals; online RL captures these signals through environment interaction, but suffers from sparse rewards and prohibitive deployment costs. To address it, we present Semi-online Reinforcement Learning, a novel paradigm that simulates online RL on offline trajectories. During each rollout process, we preserve the original model output within the multi-turn dialogue, where a Patch Module adaptively recovers the divergence between rollout and expert trajectories. To capture long-term training signals, Semi-online RL introduces discounted future returns into the reward computation and optimizes the policy with weighted step-level and episode-level advantages. We further introduce Semi-Online Performance (SOP), a metric that aligns better with true online performance, serving as a practical and effective proxy for real-world evaluation. Experiments show that ours Semi-online RL achieves SOTA performance among 7B models across four dynamic benchmarks, with significant gains over the base model (e.g., +12.0% on AndroidWorld, +23.8% on AITW), demonstrating significant progress in bridging the gap between offline training efficiency and online multi-turn reasoning. The code is available at https://github.com/X-PLUG/MobileAgent/tree/main/UI-S1.",11,17,10.48550/arXiv.2509.11543,https://doi.org/10.48550/arXiv.2509.11543,0.9900
Int25,π*0.6: a VLA That Learns From Experience,Physical Intelligence et al.,2025,2025-11-18,ArXiv,abs/2511.14759,,"We study how vision-language-action (VLA) models can improve through real-world deployments via reinforcement learning (RL). We present a general-purpose method, RL with Experience and Corrections via Advantage-conditioned Policies (RECAP), that provides for RL training of VLAs via advantage conditioning. Our method incorporates heterogeneous data into the self-improvement process, including demonstrations, data from on-policy collection, and expert teleoperated interventions provided during autonomous execution. RECAP starts by pre-training a generalist VLA with offline RL, which we call $\pi^{*}_{0.6}$, that can then be specialized to attain high performance on downstream tasks through on-robot data collection. We show that the $\pi^{*}_{0.6}$ model trained with the full RECAP method can fold laundry in real homes, reliably assemble boxes, and make espresso drinks using a professional espresso machine. On some of the hardest tasks, RECAP more than doubles task throughput and roughly halves the task failure rate.",112,224,10.48550/arXiv.2511.14759,https://doi.org/10.48550/arXiv.2511.14759,0.9800
Lu25h,VLA-RL: Towards Masterful and General Robotic Manipulation with Scalable Reinforcement Learning,Guanxing Lu et al.,2025,2025-05-24,ArXiv,abs/2505.18719,,"Recent high-capacity vision-language-action (VLA) models have demonstrated impressive performance on a range of robotic manipulation tasks by imitating human demonstrations. However, exploiting offline data with limited visited states will cause execution failure in out-of-distribution scenarios. Intuitively, an exploration-based method that improves on online collected data at test time could address this limitation. We present VLA-RL, an algorithmic and systematic framework that leverages online reinforcement learning (RL) to improve pretrained auto-regressive VLAs in downstream tasks. Within a unified perspective, we first introduce a trajectory-level RL formulation for auto-regressive VLA training, which models general robotic manipulation trajectory as multi-modal multi-turn conversation. To address the challenge of sparse rewards, we fine-tune a pretrained vision-language model as a robotic process reward model, which is trained on pseudo reward labels annotated on automatically extracted task segments. To scale up, we identify several implementation findings that improve the stability and efficiency including curriculum selection strategy, GPU-balanced vectorized environments, batch decoding, and critic warmup. VLA-RL enables OpenVLA-7B to surpass the strongest finetuned baseline by 4.5% on 40 challenging robotic manipulation tasks in LIBERO, and even matches the performance of advanced commercial models such as $\pi_0$-FAST. Notably, we observe that VLA-RL benefits from increased test-time optimization, indicating an early spark of inference scaling laws in robotics.",109,113,10.48550/arXiv.2505.18719,https://doi.org/10.48550/arXiv.2505.18719,0.9700
Don26,Agent-World: Scaling Real-World Environment Synthesis for Evolving General Agent Intelligence,Guanting Dong et al.,2026,2026-04-20,,,,"Large language models are increasingly expected to serve as general-purpose agents that interact with external, stateful tool environments. The Model Context Protocol (MCP) and broader agent skills offer a unified interface for connecting agents with scalable real-world services, but training robust agents remains limited by the lack of realistic environments and principled mechanisms for life-long learning. In this paper, we present \textbf{Agent-World}, a self-evolving training arena for advancing general agent intelligence through scalable environments. Agent-World has two main components: (1) Agentic Environment-Task Discovery, which autonomously explores topic-aligned databases and executable tool ecosystems from thousands of real-world environment themes and synthesizes verifiable tasks with controllable difficulty; and (2) Continuous Self-Evolving Agent Training, which combines multi-environment reinforcement learning with a self-evolving agent arena that automatically identifies capability gaps through dynamic task synthesis and drives targeted learning, enabling the co-evolution of agent policies and environments. Across 23 challenging agent benchmarks, Agent-World-8B and 14B consistently outperforms strong proprietary models and environment scaling baselines. Further analyses reveal scaling trends in relation to environment diversity and self-evolution rounds, offering insights for building general agent intelligence.",0,,,https://www.semanticscholar.org/paper/d9a21887951d95f8a4923f10e8b4815a073f8d35,0.9700
Wan25ag,Beyond Policy Optimization: A Data Curation Flywheel for Sparse-Reward Long-Horizon Planning,Yutong Wang et al.,2025,2025-08-05,ArXiv,abs/2508.03018,,"Large Language Reasoning Models have demonstrated remarkable success on static tasks, yet their application to multi-round agentic planning in interactive environments faces two fundamental challenges. First, the intractable credit assignment problem renders conventional reinforcement learning ineffective in sparse-reward settings. Second, the computational overhead of verbose, step-by-step reasoning histories is prohibitive. To address these challenges, we propose BPO, a three-stage framework (bootstrapping, extrapolation, and refinement) that establishes a self-improving data flywheel to develop robust reasoning models for long-horizon, sparse-reward environments. Our framework first bootstraps efficient reasoning using the proposed planning quaternions with long-short chain-of-thought fusion. It then extrapolates to out-of-distribution tasks through complexity-stratified curriculum learning. Finally, the model iteratively refines itself by learning exclusively on experiences selected via reward-gated rejection sampling. Experiments on ALFWorld, ScienceWorld, and WebShop demonstrate that our approach achieves state-of-the-art with significant token efficiency, providing a new recipe for reasoning models in agentic planning.",3,3.9,10.48550/arXiv.2508.03018,https://doi.org/10.48550/arXiv.2508.03018,0.9700
Li25aa,SimpleVLA-RL: Scaling VLA Training via Reinforcement Learning,Haozhan Li et al.,2025,2025-09-11,ArXiv,abs/2509.09674,,"Vision-Language-Action (VLA) models have recently emerged as a powerful paradigm for robotic manipulation. Despite substantial progress enabled by large-scale pretraining and supervised fine-tuning (SFT), these models face two fundamental challenges: (i) the scarcity and high cost of large-scale human-operated robotic trajectories required for SFT scaling, and (ii) limited generalization to tasks involving distribution shift. Recent breakthroughs in Large Reasoning Models (LRMs) demonstrate that reinforcement learning (RL) can dramatically enhance step-by-step reasoning capabilities, raising a natural question: Can RL similarly improve the long-horizon step-by-step action planning of VLA? In this work, we introduce SimpleVLA-RL, an efficient RL framework tailored for VLA models. Building upon veRL, we introduce VLA-specific trajectory sampling, scalable parallelization, multi-environment rendering, and optimized loss computation. When applied to OpenVLA-OFT, SimpleVLA-RL achieves SoTA performance on LIBERO and even outperforms $\pi_0$ on RoboTwin 1.0\&2.0 with the exploration-enhancing strategies we introduce. SimpleVLA-RL not only reduces dependence on large-scale data and enables robust generalization, but also remarkably surpasses SFT in real-world tasks. Moreover, we identify a novel phenomenon ``pushcut''during RL training, wherein the policy discovers previously unseen patterns beyond those seen in the previous training process. Github: https://github.com/PRIME-RL/SimpleVLA-RL",75,113,10.48550/arXiv.2509.09674,https://doi.org/10.48550/arXiv.2509.09674,0.9600
Xu25k,EPO: Entropy-regularized Policy Optimization for LLM Agents Reinforcement Learning,Wujiang Xu et al.,2025,2025-09-26,ArXiv,abs/2509.22576,,"Training LLM agents in multi-turn environments with sparse rewards, where completing a single task requires 30+ turns of interaction within an episode, presents a fundamental challenge for reinforcement learning. We identify a critical failure mode unique to this setting: the exploration-exploitation cascade failure. This cascade begins with early-stage policy premature convergence, where sparse feedback causes agents to commit to flawed, low-entropy strategies. Subsequently, agents enter late-stage policy collapse, where conventional entropy regularization becomes counterproductive, promoting chaotic exploration that destabilizes training. We propose Entropy-regularized Policy Optimization (EPO), a general framework that breaks this failure cycle through three synergistic mechanisms: (1) adopting entropy regularization in multi-turn settings to enhance exploration, (2) an entropy smoothing regularizer that bounds policy entropy within historical averages to prevent abrupt fluctuations, and (3) adaptive phase-based weighting that balances exploration and exploitation across training. Our analysis justifies that EPO guarantees monotonically decreasing entropy variance while maintaining convergence. EPO achieves up to 152% performance improvement on ScienceWorld and up to 19.8% on ALFWorld. Our work demonstrates that multi-turn sparse-reward settings require fundamentally different entropy control than traditional RL, with broad implications for LLM agent training.",6,9.7,10.48550/arXiv.2509.22576,https://doi.org/10.48550/arXiv.2509.22576,0.9600
Zha25ao,RLVMR: Reinforcement Learning with Verifiable Meta-Reasoning Rewards for Robust Long-Horizon Agents,"Zijing Zhang, Ziyang Chen, Mingxiao Li, Zhaopeng Tu, and Xiaolong Li",2025,2025-07-30,ArXiv,abs/2507.22844,,"The development of autonomous agents for complex, long-horizon tasks is a central goal in AI. However, dominant training paradigms face a critical limitation: reinforcement learning (RL) methods that optimize solely for final task success often reinforce flawed or inefficient reasoning paths, a problem we term inefficient exploration. This leads to agents that are brittle and fail to generalize, as they learn to find solutions without learning how to reason coherently. To address this, we introduce RLVMR, a novel framework that integrates dense, process-level supervision into end-to-end RL by rewarding verifiable, meta-reasoning behaviors. RLVMR equips an agent to explicitly tag its cognitive steps, such as planning, exploration, and reflection, and provides programmatic, rule-based rewards for actions that contribute to effective problem-solving. These process-centric rewards are combined with the final outcome signal and optimized using a critic-free policy gradient method. On the challenging ALFWorld and ScienceWorld benchmarks, RLVMR achieves new state-of-the-art results, with our 7B model reaching an 83.6% success rate on the most difficult unseen task split. Our analysis confirms these gains stem from improved reasoning quality, including significant reductions in redundant actions and enhanced error recovery, leading to more robust, efficient, and interpretable agents.",33,42,10.48550/arXiv.2507.22844,https://doi.org/10.48550/arXiv.2507.22844,0.9600
Zha25am,Tool-R1: Sample-Efficient Reinforcement Learning for Agentic Tool Use,Yabo Zhang et al.,2025,2025-09-16,ArXiv,abs/2509.12867,,"Large language models (LLMs) have demonstrated strong capabilities in language understanding and reasoning, yet they remain limited when tackling real-world tasks that require up-to-date knowledge, precise operations, or specialized tool use. To address this, we propose Tool-R1, a reinforcement learning framework that enables LLMs to perform general, compositional, and multi-step tool use by generating executable Python code. Tool-R1 supports integration of user-defined tools and standard libraries, with variable sharing across steps to construct coherent workflows. An outcome-based reward function, combining LLM-based answer judgment and code execution success, guides policy optimization. To improve training efficiency, we maintain a dynamic sample queue to cache and reuse high-quality trajectories, reducing the overhead of costly online sampling. Experiments on the GAIA benchmark show that Tool-R1 substantially improves both accuracy and robustness, achieving about 10\% gain over strong baselines, with larger improvements on complex multi-step tasks. These results highlight the potential of Tool-R1 for enabling reliable and efficient tool-augmented reasoning in real-world applications. Our code will be available at https://github.com/YBYBZhang/Tool-R1.",4,6.2,10.48550/arXiv.2509.12867,https://doi.org/10.48550/arXiv.2509.12867,0.9500
Zha25al,EvolveSearch: An Iterative Self-Evolving Search Agent,Dingchu Zhang et al.,2025,2025-05-28,Conference on Empirical Methods in Natural Language Processing,,13123-13136,"The rapid advancement of large language models (LLMs) has transformed the landscape of agentic information seeking capabilities through the integration of tools such as search engines and web browsers. However, current mainstream approaches for enabling LLM web search proficiency face significant challenges: supervised fine-tuning struggles with data production in open-search domains, while RL converges quickly, limiting their data utilization efficiency. To address these issues, we propose EvolveSearch, a novel iterative self-evolution framework that combines SFT and RL to enhance agentic web search capabilities without any external human-annotated reasoning data. Extensive experiments on seven multi-hop question-answering (MHQA) benchmarks demonstrate that EvolveSearch consistently improves performance across iterations, ultimately achieving an average improvement of 4.7\% over the current state-of-the-art across seven benchmarks, opening the door to self-evolution agentic capabilities in open web search domains.",34,36,10.48550/arXiv.2505.22501,https://doi.org/10.48550/arXiv.2505.22501,0.9500
Fan25c,WebEvolver: Enhancing Web Agent Self-Improvement with Coevolving World Model,Tianqing Fang et al.,2025,2025-04-23,ArXiv,abs/2504.21024,,"Agent self-improvement, where the backbone Large Language Model (LLM) of the agent are trained on trajectories sampled autonomously based on their own policies, has emerged as a promising approach for enhancing performance. Recent advancements, particularly in web environments, face a critical limitation: their performance will reach a stagnation point during autonomous learning cycles, hindering further improvement. We argue that this stems from limited exploration of the web environment and insufficient exploitation of pre-trained web knowledge in LLMs. To improve the performance of self-improvement, we propose a novel framework that introduces a co-evolving World Model LLM. This world model predicts the next observation based on the current observation and action within the web environment. Leveraging LLMs'pretrained knowledge of abundant web content, the World Model serves dual roles: (1) as a virtual web server generating self-instructed training data to continuously refine the agent's policy, and (2) as an imagination engine during inference, enabling look-ahead simulation to guide action selection for the agent LLM. Experiments in real-world web environments (Mind2Web-Live, WebVoyager, and GAIA-web) show a 10% performance gain over existing self-evolving agents, demonstrating the efficacy and generalizability of our approach, without using any distillation from more powerful close-sourced models. Our work establishes the necessity of integrating world models into autonomous agent frameworks to unlock sustained adaptability. Code is available at https://github.com/Tencent/SelfEvolvingAgent",32,31,10.48550/arXiv.2504.21024,https://doi.org/10.48550/arXiv.2504.21024,0.9500
