Cite Key,Title,Authors,Year,Publication Date,Journal,Volume,Pages,Abstract,Citation Count,Citations/Year,DOI,URL,Relevance Score
Tan25n,MagicGUI: A Foundational Mobile GUI Agent with Scalable Data Pipeline and Reinforcement Fine-tuning,Liujian Tang et al.,2025,2025-07-19,ArXiv,abs/2508.03700,,"This paper presents MagicGUI, a foundational mobile GUI agent designed to address critical challenges in perception, grounding, and reasoning within real-world mobile GUI environments. The framework is underpinned by following six key components: (1) a comprehensive and accurate dataset, constructed via the scalable GUI Data Pipeline, which aggregates the largest and most diverse GUI-centric multimodal data to date from open-source repositories, automated crawling, and targeted manual annotation; (2) enhanced perception and grounding capabilities, facilitating fine-grained multimodal alignment for UI element referencing, grounding, and screen comprehension; (3) a comprehensive and unified action space, encompassing both fundamental UI operations and complex interactive intents to support human-agent interactions; (4) planning-oriented reasoning mechanisms that enable the model to decompose complex user instructions into sequential actions with explicit intermediate meta-paln reasoning; (5) an iterative two-stage training procedure, combining large-scale continue pre-training on 7.8M samples with reinforcement fine-tuning utilizing a spatially enhanced composite reward and dual filtering strategy; and (6) competitive performance on both the proprietary Magic-RICH benchmark and over a dozen public benchmarks, achieving superior performance across GUI perception and agent tasks, while demonstrating robust generalization and real-world deployment potential in practical mobile GUI scenarios, as detailed in Figure 1.",14,17,10.48550/arXiv.2508.03700,https://doi.org/10.48550/arXiv.2508.03700,0.9000
Zhe26c,Adaptive Milestone Reward for GUI Agents,Congmin Zheng et al.,2026,2026-02-12,ArXiv,abs/2602.11524,,"Reinforcement Learning (RL) has emerged as a mainstream paradigm for training Mobile GUI Agents, yet it struggles with the temporal credit assignment problem inherent in long-horizon tasks. A primary challenge lies in the trade-off between reward fidelity and density: outcome reward offers high fidelity but suffers from signal sparsity, while process reward provides dense supervision but remains prone to bias and reward hacking. To resolve this conflict, we propose the Adaptive Milestone Reward (ADMIRE) mechanism. ADMIRE constructs a verifiable, adaptive reward system by anchoring trajectory to milestones, which are dynamically distilled from successful explorations. Crucially, ADMIRE integrates an asymmetric credit assignment strategy that denoises successful trajectories and scaffolds failed trajectories. Extensive experiments demonstrate that ADMIRE consistently yields over 10% absolute improvement in success rate across different base models on AndroidWorld. Moreover, the method exhibits robust generalizability, achieving strong performance across diverse RL algorithms and heterogeneous environments such as web navigation and embodied tasks.",2,4.0,10.48550/arXiv.2602.11524,https://doi.org/10.48550/arXiv.2602.11524,0.9000
Liu26n,On-the-Fly VLA Adaptation via Test-Time Reinforcement Learning,Changyu Liu et al.,2026,2026-01-11,ArXiv,abs/2601.06748,,"Vision-Language-Action models have recently emerged as a powerful paradigm for general-purpose robot learning, enabling agents to map visual observations and natural-language instructions into executable robotic actions. Though popular, they are primarily trained via supervised fine-tuning or training-time reinforcement learning, requiring explicit fine-tuning phases, human interventions, or controlled data collection. Consequently, existing methods remain unsuitable for challenging simulated- or physical-world deployments, where robots must respond autonomously and flexibly to evolving environments. To address this limitation, we introduce a Test-Time Reinforcement Learning for VLAs (TT-VLA), a framework that enables on-the-fly policy adaptation during inference. TT-VLA formulates a dense reward mechanism that leverages step-by-step task-progress signals to refine action policies during test time while preserving the SFT/RL-trained priors, making it an effective supplement to current VLA models. Empirical results show that our approach enhances overall adaptability, stability, and task success in dynamic, previously unseen scenarios under simulated and real-world settings. We believe TT-VLA offers a principled step toward self-improving, deployment-ready VLAs.",2,4.0,10.48550/arXiv.2601.06748,https://doi.org/10.48550/arXiv.2601.06748,0.8800
Lin25h,AWPO: Enhancing Tool-Use of Large Language Models through Explicit Integration of Reasoning Rewards,Zihan Lin et al.,2025,2025-12-22,ArXiv,abs/2512.19126,,"While Reinforcement Learning (RL) shows promise in training tool-use Large Language Models (LLMs) using verifiable outcome rewards, existing methods largely overlook the potential of reasoning rewards based on chain-of-thought quality for better tool utilization. Furthermore, na\""ively combining reasoning and outcome rewards may yield suboptimal performance or conflict with the primary optimization objective. To address this, we propose Advantage-Weighted Policy Optimization (AWPO), a principled RL framework that adaptively integrates reasoning rewards into advantage estimation to improve tool-use performance. AWPO incorporates variance-aware gating and difficulty-aware weighting to adaptively modulate advantages from reasoning signals based on group-relative statistics, alongside a tailored clipping mechanism for stable optimization. Extensive experiments demonstrate that AWPO achieves state-of-the-art performance across standard tool-use benchmarks, significantly outperforming strong baselines and leading closed-source models in challenging multi-turn scenarios. Notably, with exceptional parameter efficiency, our 4B model surpasses Grok-4 by $16.0\%$ in multi-turn accuracy while preserving generalization capability on the out-of-distribution MMLU-Pro benchmark.",0,,10.48550/arXiv.2512.19126,https://doi.org/10.48550/arXiv.2512.19126,0.8800
Wan25ah,SWE-Dev: Building Software Engineering Agents with Training and Inference Scaling,"Haoran Wang, Zhenyu Hou, Yao Wei, Jie Tang, and Yuxiao Dong",2025,2025-06-09,Annual Meeting of the Association for Computational Linguistics,,3742-3761,"Large language models (LLMs) have advanced rapidly from conversational problem solving to addressing real-world tasks involving tool use, such as software engineering (SWE). Recent LLM-powered toolkits, such as OpenAI Codex and Cursor, have offered end-to-end automation of the software development process. However, building effective SWE agents remains challenging due to the lack of high-quality training data and effective test cases. To address this issue, we present SWE-Dev, an SWE agent built upon open-source LLMs. First, we develop a robust pipeline to synthesize test cases for patch evaluation. Second, we scale up agent trajectories to construct the training data for building SWE-Dev. Experiments on the SWE-bench-Verified benchmark show that the SWE-Dev models can achieve top performance among all open SWE agents. Specifically, the success rates of the SWE-Dev 7B and 32B parameter models reach 23.4% and 36.6%, respectively, outperforming state-of-the-art open-source models. All code, models, and datasets are publicly available at https://github.com/THUDM/SWE-Dev.",13,14,10.48550/arXiv.2506.07636,https://doi.org/10.48550/arXiv.2506.07636,0.8800
Gan26b,Android Coach: Improve Online Agentic Training Efficiency with Single State Multiple Actions,Guo Gan et al.,2026,2026-04-08,,,,"Online reinforcement learning (RL) serves as an effective method for enhancing the capabilities of Android agents. However, guiding agents to learn through online interaction is prohibitively expensive due to the high latency of emulators and the sample inefficiency of existing RL algorithms. We identify a fundamental limitation in current approaches: the Single State Single Action paradigm, which updates the policy with one-to-one state-action pairs from online one-way rollouts without fully exploring each costly emulator state. In this paper, we propose Android Coach, a novel framework that shifts the training paradigm to Single State Multiple Actions, allowing the agent to sample and utilize multiple actions for a single online state. We enable this without additional emulator overhead by learning a critic that estimates action values. To ensure the critic serves as a reliable coach, we integrate a process reward model and introduce a group-wise advantage estimator based on the averaged critic outputs. Extensive experiments demonstrate the effectiveness and efficiency of Android Coach: it achieves 7.5% and 8.3% success rate improvements on AndroidLab and AndroidWorld over UI-TARS-1.5-7B, and attains 1.4x higher training efficiency than Single State Single Action methods PPO and GRPO at matched success rates.",5,10,,https://www.semanticscholar.org/paper/1296ec6a74a90d25122245a551ec7facb4252916,0.8800
Hu25i,"WebCoT: Enhancing Web Agent Reasoning by Reconstructing Chain-of-Thought in Reflection, Branching, and Rollback",Minda Hu et al.,2025,2025-05-26,ArXiv,abs/2505.20013,,"Web agents powered by Large Language Models (LLMs) show promise for next-generation AI, but their limited reasoning in uncertain, dynamic web environments hinders robust deployment. In this paper, we identify key reasoning skills essential for effective web agents, i.e., reflection&lookahead, branching, and rollback, and curate trajectory data that exemplifies these abilities by reconstructing the agent's (inference-time) reasoning algorithms into chain-of-thought rationales. We conduct experiments in the agent self-improving benchmark, OpenWebVoyager, and demonstrate that distilling salient reasoning patterns into the backbone LLM via simple fine-tuning can substantially enhance its performance. Our approach yields significant improvements across multiple benchmarks, including WebVoyager, Mind2web-live, and SimpleQA (web search), highlighting the potential of targeted reasoning skill enhancement for web agents.",11,11,10.48550/arXiv.2505.20013,https://doi.org/10.48550/arXiv.2505.20013,0.8800
Guo26b,VLAW: Iterative Co-Improvement of Vision-Language-Action Policy and World Model,Yanjiang Guo et al.,2026,2026-02-12,ArXiv,abs/2602.12063,,"The goal of this paper is to improve the performance and reliability of vision-language-action (VLA) models through iterative online interaction. Since collecting policy rollouts in the real world is expensive, we investigate whether a learned simulator-specifically, an action-conditioned video generation model-can be used to generate additional rollout data. Unfortunately, existing world models lack the physical fidelity necessary for policy improvement: they are predominantly trained on demonstration datasets that lack coverage of many different physical interactions (particularly failure cases) and struggle to accurately model small yet critical physical details in contact-rich object manipulation. We propose a simple iterative improvement algorithm that uses real-world roll-out data to improve the fidelity of the world model, which can then, in turn, be used to generate supplemental synthetic data for improving the VLA model. In our experiments on a real robot, we use this approach to improve the performance of a state-of-the-art VLA model on multiple downstream tasks. We achieve a 39.2% absolute success rate improvement over the base policy and 11.6% improvement from training with the generated synthetic rollouts. Videos can be found at this anonymous website: https://sites.google.com/view/vla-w",8,16,10.48550/arXiv.2602.12063,https://doi.org/10.48550/arXiv.2602.12063,0.8700
Szo23,Large Language Models as Generalizable Policies for Embodied Tasks,Andrew Szot et al.,2023,2023-10-26,ArXiv,abs/2310.17722,,"We show that large language models (LLMs) can be adapted to be generalizable policies for embodied visual tasks. Our approach, called Large LAnguage model Reinforcement Learning Policy (LLaRP), adapts a pre-trained frozen LLM to take as input text instructions and visual egocentric observations and output actions directly in the environment. Using reinforcement learning, we train LLaRP to see and act solely through environmental interactions. We show that LLaRP is robust to complex paraphrasings of task instructions and can generalize to new tasks that require novel optimal behavior. In particular, on 1,000 unseen tasks it achieves 42% success rate, 1.7x the success rate of other common learned baselines or zero-shot applications of LLMs. Finally, to aid the community in studying language conditioned, massively multi-task, embodied AI problems we release a novel benchmark, Language Rearrangement, consisting of 150,000 training and 1,000 testing tasks for language-conditioned rearrangement. Video examples of LLaRP in unseen Language Rearrangement instructions are at https://llm-rl.github.io.",114,45,10.48550/arXiv.2310.17722,https://doi.org/10.48550/arXiv.2310.17722,0.8600
Lat24,Sparse Rewards Can Self-Train Dialogue Agents,"B. Lattimer, Varun Gangal, Ryan Mcdonald, and Yi Yang",2024,2024-09-06,ArXiv,abs/2409.04617,,"Recent advancements in state-of-the-art (SOTA) Large Language Model (LLM) agents, especially in multi-turn dialogue tasks, have been primarily driven by supervised fine-tuning and high-quality human feedback. However, as base LLM models continue to improve, acquiring meaningful human feedback has become increasingly challenging and costly. In certain domains, base LLM agents may eventually exceed human capabilities, making traditional feedback-driven methods impractical. In this paper, we introduce a novel self-improvement paradigm that empowers LLM agents to autonomously enhance their performance without external human feedback. Our method, Juxtaposed Outcomes for Simulation Harvesting (JOSH), is a self-alignment algorithm that leverages a sparse reward simulation environment to extract ideal behaviors and further train the LLM on its own outputs. We present ToolWOZ, a sparse reward tool-calling simulation environment derived from MultiWOZ. We demonstrate that models trained with JOSH, both small and frontier, significantly improve tool-based interactions while preserving general model capabilities across diverse benchmarks. Our code and data are publicly available on GitHub at https://github.com/asappresearch/josh-llm-simulation-training",4,2.4,10.48550/arXiv.2409.04617,https://doi.org/10.48550/arXiv.2409.04617,0.8600
Mo25,Multi-Agent Tool-Integrated Policy Optimization,"Zhanfeng Mo, Xingxuan Li, Yuntao Chen, and Lidong Bing",2025,2025-10-06,ArXiv,abs/2510.04678,,"Large language models (LLMs) increasingly rely on multi-turn tool-integrated planning for knowledge-intensive and complex reasoning tasks. Existing implementations typically rely on a single agent, but they suffer from limited context length and noisy tool responses. A natural solution is to adopt a multi-agent framework with planner- and worker-agents to manage context. However, no existing methods support effective reinforcement learning post-training of tool-integrated multi-agent frameworks. To address this gap, we propose Multi-Agent Tool-Integrated Policy Optimization (MATPO), which enables distinct roles (planner and worker) to be trained within a single LLM instance using role-specific prompts via reinforcement learning. MATPO is derived from a principled credit assignment mechanism across planner and worker rollouts. This design eliminates the need to deploy multiple LLMs, which would be memory-intensive, while preserving the benefits of specialization. Experiments on GAIA-text, WebWalkerQA, and FRAMES show that MATPO consistently outperforms single-agent baselines by an average of 18.38% relative improvement in performance and exhibits greater robustness to noisy tool outputs. Our findings highlight the effectiveness of unifying multiple agent roles within a single LLM and provide practical insights for stable and efficient multi-agent RL training.",4,6.7,10.48550/arXiv.2510.04678,https://doi.org/10.48550/arXiv.2510.04678,0.8600
Wei25c,Toward Training Superintelligent Software Agents through Self-Play SWE-RL,Yuxiang Wei et al.,2025,2025-12-21,ArXiv,abs/2512.18552,,"While current software agents powered by large language models (LLMs) and agentic reinforcement learning (RL) can boost programmer productivity, their training data (e.g., GitHub issues and pull requests) and environments (e.g., pass-to-pass and fail-to-pass tests) heavily depend on human knowledge or curation, posing a fundamental barrier to superintelligence. In this paper, we present Self-play SWE-RL (SSR), a first step toward training paradigms for superintelligent software agents. Our approach takes minimal data assumptions, only requiring access to sandboxed repositories with source code and installed dependencies, with no need for human-labeled issues or tests. Grounded in these real-world codebases, a single LLM agent is trained via reinforcement learning in a self-play setting to iteratively inject and repair software bugs of increasing complexity, with each bug formally specified by a test patch rather than a natural language issue description. On the SWE-bench Verified and SWE-Bench Pro benchmarks, SSR achieves notable self-improvement (+10.4 and +7.8 points, respectively) and consistently outperforms the human-data baseline over the entire training trajectory, despite being evaluated on natural language issues absent from self-play. Our results, albeit early, suggest a path where agents autonomously gather extensive learning experiences from real-world software repositories, ultimately enabling superintelligent systems that exceed human capabilities in understanding how systems are constructed, solving novel challenges, and autonomously creating new software from scratch.",14,28,10.48550/arXiv.2512.18552,https://doi.org/10.48550/arXiv.2512.18552,0.8600
Li26r,SQL-ASTRA: Alleviating Sparse Feedback in Agentic SQL via Column-Set Matching and Trajectory Aggregation,Long Li et al.,2026,2026-03-17,,,,"Agentic Reinforcement Learning (RL) shows promise for complex tasks, but Text-to-SQL remains mostly restricted to single-turn paradigms. A primary bottleneck is the credit assignment problem. In traditional paradigms, rewards are determined solely by the final-turn feedback, which ignores the intermediate process and leads to ambiguous credit evaluation. To address this, we propose Agentic SQL, a framework featuring a universal two-tiered reward mechanism designed to provide effective trajectory-level evaluation and dense step-level signals. First, we introduce Aggregated Trajectory Reward (ATR) to resolve multi-turn credit assignment. Using an asymmetric transition matrix, ATR aggregates process-oriented scores to incentivize continuous improvement. Leveraging Lyapunov stability theory, we prove ATR acts as an energy dissipation operator, guaranteeing a cycle-free policy and monotonic convergence. Second, Column-Set Matching Reward (CSMR) provides immediate step-level rewards to mitigate sparsity. By executing queries at each turn, CSMR converts binary (0/1) feedback into dense [0, 1] signals based on partial correctness. Evaluations on BIRD show a 5% gain over binary-reward GRPO. Notably, our approach outperforms SOTA Arctic-Text2SQL-R1-7B on BIRD and Spider 2.0 using identical models, propelling Text-to-SQL toward a robust multi-turn agent paradigm.",0,,,https://www.semanticscholar.org/paper/c31209de3302c79814903ad7c9aaa225595aaf5e,0.8600
Zha24s,Fine-Tuning Large Vision-Language Models as Decision-Making Agents via Reinforcement Learning,Yuexiang Zhai et al.,2024,2024-05-16,ArXiv,abs/2405.10292,,"Large vision-language models (VLMs) fine-tuned on specialized visual instruction-following data have exhibited impressive language reasoning capabilities across various scenarios. However, this fine-tuning paradigm may not be able to efficiently learn optimal decision-making agents in multi-step goal-directed tasks from interactive environments. To address this challenge, we propose an algorithmic framework that fine-tunes VLMs with reinforcement learning (RL). Specifically, our framework provides a task description and then prompts the VLM to generate chain-of-thought (CoT) reasoning, enabling the VLM to efficiently explore intermediate reasoning steps that lead to the final text-based action. Next, the open-ended text output is parsed into an executable action to interact with the environment to obtain goal-directed task rewards. Finally, our framework uses these task rewards to fine-tune the entire VLM with RL. Empirically, we demonstrate that our proposed framework enhances the decision-making capabilities of VLM agents across various tasks, enabling 7b models to outperform commercial models such as GPT4-V or Gemini. Furthermore, we find that CoT reasoning is a crucial component for performance improvement, as removing the CoT reasoning results in a significant decrease in the overall performance of our method.",172,87,10.48550/arXiv.2405.10292,https://doi.org/10.48550/arXiv.2405.10292,0.8500
Guo25f,MTSQL-R1: Towards Long-Horizon Multi-Turn Text-to-SQL via Agentic Training,Taicheng Guo et al.,2025,2025-10-12,ArXiv,abs/2510.12831,,"Multi-turn Text-to-SQL aims to translate a user's conversational utterances into executable SQL while preserving dialogue coherence and grounding to the target schema. However, most existing systems only regard this task as a simple text translation task and follow a short-horizon paradigm, generating a query per turn without execution, explicit verification, and refinement, which leads to non-executable or incoherent outputs. We present MTSQL-R1, an agentic training framework for long-horizon multi-turn Text-to-SQL. We cast the task as a Markov Decision Process (MDP) in which an agent interacts with (i) a database for execution feedback and (ii) a persistent dialogue memory for coherence verification, performing an iterative propose to execute ->verify ->refine cycle until all checks pass. Experiments on COSQL and SPARC demonstrate that MTSQL-R1 consistently outperforms strong baselines, highlighting the importance of environment-driven verification and memory-guided refinement for conversational semantic parsing. Full recipes (including code, trained models, logs, reasoning trajectories, etc.) will be released after the internal review to contribute to community research.",2,3.5,10.48550/arXiv.2510.12831,https://doi.org/10.48550/arXiv.2510.12831,0.8500
Zen23d,AgentTuning: Enabling Generalized Agent Abilities for LLMs,Aohan Zeng et al.,2023,2023-10-19,ArXiv,abs/2310.12823,,"Open large language models (LLMs) with great performance in various tasks have significantly advanced the development of LLMs. However, they are far inferior to commercial models such as ChatGPT and GPT-4 when acting as agents to tackle complex tasks in the real world. These agent tasks employ LLMs as the central controller responsible for planning, memorization, and tool utilization, necessitating both fine-grained prompting methods and robust LLMs to achieve satisfactory performance. Though many prompting methods have been proposed to complete particular agent tasks, there is lack of research focusing on improving the agent capabilities of LLMs themselves without compromising their general abilities. In this work, we present AgentTuning, a simple and general method to enhance the agent abilities of LLMs while maintaining their general LLM capabilities. We construct AgentInstruct, a lightweight instruction-tuning dataset containing high-quality interaction trajectories. We employ a hybrid instruction-tuning strategy by combining AgentInstruct with open-source instructions from general domains. AgentTuning is used to instruction-tune the Llama 2 series, resulting in AgentLM. Our evaluations show that AgentTuning enables LLMs' agent capabilities without compromising general abilities. The AgentLM-70B is comparable to GPT-3.5-turbo on unseen agent tasks, demonstrating generalized agent capabilities. We open source the AgentInstruct and AgentLM-7B, 13B, and 70B models at https://github.com/THUDM/AgentTuning, serving open and powerful alternatives to commercial LLMs for agent tasks.",298,116,10.48550/arXiv.2310.12823,https://doi.org/10.48550/arXiv.2310.12823,0.8500
