Cite Key,Title,Authors,Year,Publication Date,Journal,Volume,Pages,Abstract,Citation Count,Citations/Year,DOI,URL,Relevance Score
Lai25c,ComputerRL: Scaling End-to-End Online Reinforcement Learning for Computer Use Agents,Hanyu Lai et al.,2025,2025-08-19,ArXiv,abs/2508.14040,,"We introduce ComputerRL, a framework for autonomous desktop intelligence that enables agents to operate complex digital workspaces skillfully. ComputerRL features the API-GUI paradigm, which unifies programmatic API calls and direct GUI interaction to address the inherent mismatch between machine agents and human-centric desktop environments. Scaling end-to-end RL training is crucial for improvement and generalization across diverse desktop tasks; however, it remains challenging due to environmental inefficiency and instability during extended training. To support scalable and robust training, we develop a distributed RL infrastructure capable of orchestrating thousands of parallel virtual desktop environments to accelerate large-scale online RL. Furthermore, we propose Entropulse, a training strategy that alternates reinforcement learning with supervised fine-tuning, effectively mitigating entropy collapse during extended training runs. We employ ComputerRL on open models GLM-4-9B-0414 and GLM-4.1V-9B-Thinking, and evaluate them on the OSWorld benchmark. The AutoGLM-OS-9B achieves a new state-of-the-art accuracy of 48.9%, demonstrating significant improvements for general agents in desktop automation. Our code and the new OfficeWorld benchmark are available at https://github.com/thudm/ComputerRL. The algorithm and framework are adopted in building AutoGLM (Liu et al., 2024b).",22,30,10.48550/arXiv.2508.14040,https://doi.org/10.48550/arXiv.2508.14040,1.2300
Ye25h,Mobile-Agent-v3: Fundamental Agents for GUI Automation,Jiabo Ye et al.,2025,2025-08-21,ArXiv,abs/2508.15144,,"This paper introduces GUI-Owl, a foundational GUI agent model that achieves state-of-the-art performance among open-source end-to-end models on ten GUI benchmarks across desktop and mobile environments, covering grounding, question answering, planning, decision-making, and procedural knowledge. GUI-Owl-7B achieves 66.4 on AndroidWorld and 29.4 on OSWorld. Building on this, we propose Mobile-Agent-v3, a general-purpose GUI agent framework that further improves performance to 73.3 on AndroidWorld and 37.7 on OSWorld, setting a new state-of-the-art for open-source GUI agent frameworks. GUI-Owl incorporates three key innovations: (1) Large-scale Environment Infrastructure: a cloud-based virtual environment spanning Android, Ubuntu, macOS, and Windows, enabling our Self-Evolving GUI Trajectory Production framework. This generates high-quality interaction data via automated query generation and correctness validation, leveraging GUI-Owl to refine trajectories iteratively, forming a self-improving loop. It supports diverse data pipelines and reduces manual annotation. (2) Diverse Foundational Agent Capabilities: by integrating UI grounding, planning, action semantics, and reasoning patterns, GUI-Owl supports end-to-end decision-making and can act as a modular component in multi-agent systems. (3) Scalable Environment RL: we develop a scalable reinforcement learning framework with fully asynchronous training for real-world alignment. We also introduce Trajectory-aware Relative Policy Optimization (TRPO) for online RL, achieving 34.9 on OSWorld. GUI-Owl and Mobile-Agent-v3 are open-sourced at https://github.com/X-PLUG/MobileAgent.",100,139,10.48550/arXiv.2508.15144,https://doi.org/10.48550/arXiv.2508.15144,1.2300
Xue26b,EvoCUA: Evolving Computer Use Agents via Learning from Scalable Synthetic Experience,Taofeng Xue et al.,2026,2026-01-22,ArXiv,abs/2601.15876,,"The development of native computer-use agents (CUA) represents a significant leap in multimodal AI. However, their potential is currently bottlenecked by the constraints of static data scaling. Existing paradigms relying primarily on passive imitation of static datasets struggle to capture the intricate causal dynamics inherent in long-horizon computer tasks. In this work, we introduce EvoCUA, a native computer use agentic model. Unlike static imitation, EvoCUA integrates data generation and policy optimization into a self-sustaining evolutionary cycle. To mitigate data scarcity, we develop a verifiable synthesis engine that autonomously generates diverse tasks coupled with executable validators. To enable large-scale experience acquisition, we design a scalable infrastructure orchestrating tens of thousands of asynchronous sandbox rollouts. Building on these massive trajectories, we propose an iterative evolving learning strategy to efficiently internalize this experience. This mechanism dynamically regulates policy updates by identifying capability boundaries -- reinforcing successful routines while transforming failure trajectories into rich supervision through error analysis and self-correction. Empirical evaluations on the OSWorld benchmark demonstrate that EvoCUA achieves a success rate of 56.7%, establishing a new open-source state-of-the-art. Notably, EvoCUA significantly outperforms the previous best open-source model, OpenCUA-72B (45.0%), and surpasses leading closed-weights models such as UI-TARS-2 (53.1%). Crucially, our results underscore the generalizability of this approach: the evolving paradigm driven by learning from experience yields consistent performance gains across foundation models of varying scales, establishing a robust and scalable path for advancing native agent capabilities.",10,20,10.48550/arXiv.2601.15876,https://doi.org/10.48550/arXiv.2601.15876,1.2200
Don25d,Agentic Reinforced Policy Optimization,Guanting Dong et al.,2025,2025-07-26,ArXiv,abs/2507.19849,,"Large-scale reinforcement learning with verifiable rewards (RLVR) has demonstrated its effectiveness in harnessing the potential of large language models (LLMs) for single-turn reasoning tasks. In realistic reasoning scenarios, LLMs can often utilize external tools to assist in task-solving processes. However, current RL algorithms inadequately balance the models'intrinsic long-horizon reasoning capabilities and their proficiency in multi-turn tool interactions. To bridge this gap, we propose Agentic Reinforced Policy Optimization (ARPO), a novel agentic RL algorithm tailored for training multi-turn LLM-based agents. Through preliminary experiments, we observe that LLMs tend to exhibit highly uncertain behavior, characterized by an increase in the entropy distribution of generated tokens, immediately following interactions with external tools. Motivated by this observation, ARPO incorporates an entropy-based adaptive rollout mechanism, dynamically balancing global trajectory sampling and step-level sampling, thereby promoting exploration at steps with high uncertainty after tool usage. By integrating an advantage attribution estimation, ARPO enables LLMs to internalize advantage differences in stepwise tool-use interactions. Our experiments across 13 challenging benchmarks in computational reasoning, knowledge reasoning, and deep search domains demonstrate ARPO's superiority over trajectory-level RL algorithms. Remarkably, ARPO achieves improved performance using only half of the tool-use budget required by existing methods, offering a scalable solution for aligning LLM-based agents with real-time dynamic environments. Our code and datasets are released at https://github.com/dongguanting/ARPO",87,110,10.48550/arXiv.2507.19849,https://doi.org/10.48550/arXiv.2507.19849,1.2100
Wan26ab,From Off-Policy to On-Policy: Enhancing GUI Agents via Bi-level Expert-to-Policy Assimilation,"Zezhou Wang, Ziyun Zhang, Xiaoyi Zhang, Zhuzhong Qian, and Yan Lu",2026,2026-01-09,ArXiv,abs/2601.05787,,"Vision-language models are increasingly deployed as computer-use agents (CUAs) that operate desktops and browsers. Top-performing CUAs are framework-based systems that decompose planning and execution, while end-to-end screenshot-to-action policies are easier to deploy but lag behind on benchmarks such as OSWorld-Verified. GUI datasets like OSWorld pose two bottlenecks: they expose only a few hundred interactive, verifiable tasks and environments, and expert trajectories must be gathered by interacting with these environments, making such data hard to scale. We therefore ask how reinforcement learning from verifiable rewards (RLVR) can best exploit a small pool of exist expert trajectories to train end-to-end policies. Naively mixing these off-policy traces into on-policy RLVR is brittle: even after format conversion, expert trajectories exhibit structural mismatch and distribution shift from the learner. We propose BEPA (Bi-Level Expert-to-Policy Assimilation), which turns static expert traces into policy-aligned guidance via self-rolled reachable trajectories under the base policy (LEVEL-1) and a per-task, dynamically updated cache used in RLVR (LEVEL-2). On OSWorld-Verified, BEPA improves UITARS1.5-7B success from 22.87% to 32.13% and raises a held-out split from 5.74% to 10.30%, with consistent gains on MMBench-GUI and Online-Mind2Web. Our code and data are available at: https://github.com/LEON-gittech/Verl_GUI.git",1,2.0,10.48550/arXiv.2601.05787,https://doi.org/10.48550/arXiv.2601.05787,1.2000
Luo25b,GUI-R1 : A Generalist R1-Style Vision-Language Action Model For GUI Agents,"Run Luo, Lu Wang, Wanwei He, and Xiaobo Xia",2025,2025-04-14,ArXiv,abs/2504.10458,,"Existing efforts in building Graphical User Interface (GUI) agents largely rely on the training paradigm of supervised fine-tuning on Large Vision-Language Models (LVLMs). However, this approach not only demands extensive amounts of training data but also struggles to effectively understand GUI screenshots and generalize to unseen interfaces. The issue significantly limits its application in real-world scenarios, especially for high-level tasks. Inspired by Reinforcement Fine-Tuning (RFT) in large reasoning models (e.g., DeepSeek-R1), which efficiently enhances the problem-solving capabilities of large language models in real-world settings, we propose \name, the first reinforcement learning framework designed to enhance the GUI capabilities of LVLMs in high-level real-world task scenarios, through unified action space rule modeling. By leveraging a small amount of carefully curated high-quality data across multiple platforms (including Windows, Linux, MacOS, Android, and Web) and employing policy optimization algorithms such as Group Relative Policy Optimization (GRPO) to update the model, \name achieves superior performance using only 0.02\% of the data (3K vs. 13M) compared to previous state-of-the-art methods like OS-Atlas across eight benchmarks spanning three different platforms (mobile, desktop, and web). These results demonstrate the immense potential of reinforcement learning based on unified action space rule modeling in improving the execution capabilities of LVLMs for real-world GUI agent tasks.",187,174,10.48550/arXiv.2504.10458,https://doi.org/10.48550/arXiv.2504.10458,1.1900
Gol25,"Training Long-Context, Multi-Turn Software Engineering Agents with Reinforcement Learning",Alexander Golubev et al.,2025,2025-08-05,ArXiv,abs/2508.03501,,"Research on applications of reinforcement learning (RL) to large language models has mostly been focused on single-turn problems, such as mathematical reasoning or single-shot code generation. While these problems can be viewed as token-level multi-turn Markov decision processes (MDPs), this view corresponds to a degenerate case of multi-turn interaction where the environment provides no feedback. This contrasts with many real-world domains, such as software engineering (SWE), which require rich multi-turn interactions with a stateful environment that responds to each action with a non-trivial observation. To bridge this gap, we demonstrate the successful application of RL to this general regime. Our methodology begins with rejection fine-tuning (RFT) using execution feedback to train a policy to follow instructions and formatting effectively, followed by a synchronous RL pipeline using DAPO for iterative improvement. Applying this pipeline to Qwen2.5-72B-Instruct, we increase its Pass@1 on the SWE-bench Verified benchmark from 11% to 39%, substantially improving upon the 20% RFT baseline. On the May and June splits of SWE-rebench, the resulting agent achieves Pass@1 of 35% and 31% respectively, competitive with even larger models such as DeepSeek-V3-0324 or Qwen3-235B-A22B, demonstrating that our methodology offers a practical approach for training capable agents for multi-turn interactive tasks using open-weight models.",19,25,10.48550/arXiv.2508.03501,https://doi.org/10.48550/arXiv.2508.03501,1.1800
Shi25e,MobileGUI-RL: Advancing Mobile GUI Agent through Reinforcement Learning in Online Environment,Yucheng Shi et al.,2025,2025-07-08,ArXiv,abs/2507.05720,,"Recently, there has been a surge of vision-based GUI agents designed to automate everyday mobile and web tasks. These agents interpret raw GUI screenshots and autonomously decide where to click, scroll, or type, which bypasses handcrafted rules and app-specific APIs. However, most existing methods trained GUI agent in the offline environment using pre-collected trajectories. This approach limits scalability, causes overfitting to specific UI templates, and leads to brittle policies when faced with unseen environment. We present MobileGUI-RL, a scalable framework that trains GUI agent in online environment. MobileGUI-RL contains two key components. It (i) synthesizes a curriculum of learnable tasks through self-exploration and filtering, and (ii) adapts GRPO to GUI navigation with trajectory-aware advantages and composite rewards that balance task success and execution efficiency. Experiments on three online mobile-agent benchmarks show consistent gains, validating the effectiveness of our approach.",28,33,10.48550/arXiv.2507.05720,https://doi.org/10.48550/arXiv.2507.05720,1.1700
Gu26b,Generalization in Online Reinforcement Learning for Mobile Agents,Li Gu et al.,2026,2026-03-08,,,,"Graphical user interface (GUI)-based mobile agents automate digital tasks on mobile devices by interpreting natural-language instructions and interacting with the screen. While recent methods apply reinforcement learning (RL) to train vision-language-model(VLM) agents in interactive environments with a primary focus on performance, generalization remains underexplored due to the lack of standardized benchmarks and open-source RL systems. In this work, we formalize the problem as a Contextual Markov Decision Process (CMDP) and introduce \textbf{AndroidWorld-Generalization}, a benchmark with three increasingly challenging regimes for evaluating zero-shot generalization to unseen task instances, templates, and applications. We further propose an RL training system that integrates Group Relative Policy Optimization (GRPO) with a scalable rollout collection system, consisting of containerized infrastructure and asynchronous execution % , and error recovery to support reliable and efficient training. Experiments on AndroidWorld-Generalization show that RL enables a 7B-parameter VLM agent to surpass supervised fine-tuning baselines, yielding a 26.1\% improvement on unseen instances but only limited gains on unseen templates (15.7\%) and apps (8.3\%), underscoring the challenges of generalization. As a preliminary step, we demonstrate that few-shot adaptation at test-time improves performance on unseen apps, motivating future research in this direction. To support reproducibility and fair comparison, we open-source the full RL training system, including the environment, task suite, models, prompt configurations, and the underlying infrastructure \footnote{https://github.com/zihuanjiang/AndroidWorld-Generalization}.",1,2.0,,https://www.semanticscholar.org/paper/d6c399164e39e52cd783a81f15d2869fa6ac8d1f,1.1500
Zha25ag,"AgentRL: Scaling Agentic Reinforcement Learning with a Multi-Turn, Multi-Task Framework",Hanchen Zhang et al.,2025,2025-10-05,ArXiv,abs/2510.04206,,"Recent advances in large language models (LLMs) have sparked growing interest in building generalist agents that can learn through online interactions. However, applying reinforcement learning (RL) to train LLM agents in multi-turn, multi-task settings remains challenging due to lack of scalable infrastructure and stable training algorithms. In this work, we present the AgentRL framework for scalable multi-turn, multi-task agentic RL training. On the infrastructure side, AgentRL features a fully-asynchronous generation-training pipeline for efficient multi-turn RL. To support heterogeneous environment development in multi-task RL, we design a unified function-call based API interface, containerized environment development, and a centralized controller. On the algorithm side, we propose cross-policy sampling to encourage model exploration in multi-turn settings and task advantage normalization to stabilize multi-task training. Experiments show that AgentRL, trained on open LLMs across five agentic tasks, significantly outperforms GPT-5, Clause-Sonnet-4, DeepSeek-R1, and other open-source LLM agents. Multi-task training with AgentRL matches the best results among all task-specific models. AgentRL is open-sourced at https://github.com/THUDM/AgentRL. The algorithm and framework are adopted in building \textsc{\href{https://autoglm.zhipuai.cn}{AutoGLM}}.",23,39,10.48550/arXiv.2510.04206,https://doi.org/10.48550/arXiv.2510.04206,1.1400
Ibr25,Fine-tuning with RAG for Improving LLM Learning of New Skills,"Humaid Ibrahim, Nikolai Rozanov, and Marek Rei",2025,2025-10-01,ArXiv,abs/2510.01375,,"Large language model (LLM) agents deployed for multi-step tasks frequently fail in predictable ways: attempting actions with unmet preconditions, issuing redundant commands, or mishandling environment constraints. While retrieval-augmented generation (RAG) can improve performance by providing runtime guidance, it requires maintaining external knowledge databases and adds computational overhead at every deployment. We propose a simple pipeline that converts inference-time retrieval into learned competence through distillation. Our approach: (1) extracts compact, reusable hints from agent failures, (2) uses these hints to generate improved teacher trajectories via one-shot retrieval at episode start, and (3) trains student models on these trajectories with hint strings removed, forcing internalization rather than memorization. Across two interactive benchmarks, ALFWorld (household tasks) and WebShop (online shopping), distilled students consistently outperform baseline agents, achieving up to 91% success on ALFWorld (vs. 79% for baselines) and improving WebShop scores to 72 (vs. 61 for baselines), while using 10-60% fewer tokens than retrieval-augmented teachers depending on the environment. The approach generalizes across model scales (7B/14B parameters) and agent architectures (ReAct/StateAct), demonstrating that retrieval benefits can be effectively internalized through targeted fine-tuning without permanent runtime dependencies.",1,1.6,10.48550/arXiv.2510.01375,https://doi.org/10.48550/arXiv.2510.01375,1.1300
Da25,Agent-RLVR: Training Software Engineering Agents via Guidance and Environment Rewards,Jeff Da et al.,2025,2025-06-12,ArXiv,abs/2506.11425,,"Reinforcement Learning from Verifiable Rewards (RLVR) has been widely adopted as the de facto method for enhancing the reasoning capabilities of large language models and has demonstrated notable success in verifiable domains like math and competitive programming tasks. However, the efficacy of RLVR diminishes significantly when applied to agentic environments. These settings, characterized by multi-step, complex problem solving, lead to high failure rates even for frontier LLMs, as the reward landscape is too sparse for effective model training via conventional RLVR. In this work, we introduce Agent-RLVR, a framework that makes RLVR effective in challenging agentic settings, with an initial focus on software engineering tasks. Inspired by human pedagogy, Agent-RLVR introduces agent guidance, a mechanism that actively steers the agent towards successful trajectories by leveraging diverse informational cues. These cues, ranging from high-level strategic plans to dynamic feedback on the agent's errors and environmental interactions, emulate a teacher's guidance, enabling the agent to navigate difficult solution spaces and promotes active self-improvement via additional environment exploration. In the Agent-RLVR training loop, agents first attempt to solve tasks to produce initial trajectories, which are then validated by unit tests and supplemented with agent guidance. Agents then reattempt with guidance, and the agent policy is updated with RLVR based on the rewards of these guided trajectories. Agent-RLVR elevates the pass@1 performance of Qwen-2.5-72B-Instruct from 9.4% to 22.4% on SWE-Bench Verified. We find that our guidance-augmented RLVR data is additionally useful for test-time reward model training, shown by further boosting pass@1 to 27.8%. Agent-RLVR lays the groundwork for training agents with RLVR in complex, real-world environments where conventional RL methods struggle.",19,21,10.48550/arXiv.2506.11425,https://doi.org/10.48550/arXiv.2506.11425,1.1300
Lyu25,From Correction to Mastery: Reinforced Distillation of Large Language Model Agents,"Yuanjie Lyu, Chengyu Wang, Jun Huang, and Tong Xu",2025,2025-09-12,ArXiv,abs/2509.14257,,"Large Language Model agents excel at solving complex tasks through iterative reasoning and tool use, but typically depend on ultra-large, costly backbones. Existing distillation approaches train smaller students to imitate full teacher trajectories, yet reasoning and knowledge gaps between the teacher and student can cause compounding errors. We propose SCoRe, a student-centered framework in which the student generates training trajectories and the teacher corrects only the earliest error, producing training data matched to the student's ability and exposing specific weaknesses. The student is first fine-tuned on corrected trajectories. Subsequently, short-horizon reinforcement learning starts from the verified prefix preceding the earliest error, with target rewards assigned at that step. This design encourages autonomous problem-solving beyond imitation and enhances training stability. On 12 challenging benchmarks, a 7B-parameter student distilled with SCoRe matches the agentic performance of a 72B-parameter teacher.",3,4.5,10.48550/arXiv.2509.14257,https://doi.org/10.48550/arXiv.2509.14257,1.1200
Liu25aa,Structured Agent Distillation for Large Language Model,Jun Liu et al.,2025,2025-05-20,ArXiv,abs/2505.13820,,"Large language models (LLMs) exhibit strong capabilities as decision-making agents by interleaving reasoning and actions, as seen in ReAct-style frameworks. Yet, their practical deployment is constrained by high inference costs and large model sizes. We propose Structured Agent Distillation, a framework that compresses large LLM-based agents into smaller student models while preserving both reasoning fidelity and action consistency. Unlike standard token-level distillation, our method segments trajectories into {[REASON]} and {[ACT]} spans, applying segment-specific losses to align each component with the teacher's behavior. This structure-aware supervision enables compact agents to better replicate the teacher's decision process. Experiments on ALFWorld, HotPotQA-ReAct, and WebShop show that our approach consistently outperforms token-level and imitation learning baselines, achieving significant compression with minimal performance drop. Scaling and ablation results further highlight the importance of span-level alignment for efficient and deployable agents.",4,4.1,10.48550/arXiv.2505.13820,https://doi.org/10.48550/arXiv.2505.13820,1.1100
Has24,Sub-goal Distillation: A Method to Improve Small Language Agents,"M. Hashemzadeh, Elias Stengel-Eskin, Sarath Chandar, and Marc-Alexandre Côté",2024,2024-05-04,CoLLAs,,1053-1075,"While Large Language Models (LLMs) have demonstrated significant promise as agents in interactive tasks, their substantial computational requirements and restricted number of calls constrain their practical utility, especially in long-horizon interactive tasks such as decision-making or in scenarios involving continuous ongoing tasks. To address these constraints, we propose a method for transferring the performance of an LLM with billions of parameters to a much smaller language model (770M parameters). Our approach involves constructing a hierarchical agent comprising a planning module, which learns through Knowledge Distillation from an LLM to generate sub-goals, and an execution module, which learns to accomplish these sub-goals using elementary actions. In detail, we leverage an LLM to annotate an oracle path with a sequence of sub-goals towards completing a goal. Subsequently, we utilize this annotated data to fine-tune both the planning and execution modules. Importantly, neither module relies on real-time access to an LLM during inference, significantly reducing the overall cost associated with LLM interactions to a fixed cost. In ScienceWorld, a challenging and multi-task interactive text environment, our method surpasses standard imitation learning based solely on elementary actions by 16.7% (absolute). Our analysis highlights the efficiency of our approach compared to other LLM-based methods. Our code and annotated data for distillation can be found on GitHub.",4,2.0,10.48550/arXiv.2405.02749,https://doi.org/10.48550/arXiv.2405.02749,1.0900
